ID,Título,Dirección,Código Postal,Localidad,Descripción,Accesibilidad,Servicios,Teléfonos,Emails,URLs,Horarios,Transportes
https://datos.madrid.es/egob/catalogo/tipo/entidadesyorganismos/3557-basilica-jesus-medinaceli.json,Basílica Jesús de Medinaceli,PLAZA JESUS 2,28014,MADRID,"  Metro: Antón Martín (línea 1), Banco de España (línea 2) y Sevilla (línea 2).   Bus: 001, 10, 14, 27, 34, 37, 45, C03.  Bicimad: Estación 27 (calle Jesús, 1).  Aparcamiento: Cortes (46), plaza de las Cortes.",3,N/A,,,,,
https://datos.madrid.es/egob/catalogo/tipo/entidadesyorganismos/3394-basilica-milagrosa.json,Basílica La Milagrosa,CALLE GARCIA DE PAREDES 45,28010,MADRID,"  Metro: Alonso Cano (línea 7), Gregorio Marañón (líneas 7 y 10), Iglesia (línea 1).    Bus: 12, 16, 5, 61.    Bicimad: Estaciones 125 (calle Fernández de la Hoz, 29), 246 (calle Santa Engracia, 87), 129 (calle José Abascal, 33), 247 (calle Zurbano, 90).",3,N/A,,,,,
https://datos.madrid.es/egob/catalogo/tipo/entidadesyorganismos/3371-basilica-pontificia-san-miguel.json,Basílica Pontificia de San Miguel,CALLE SAN JUSTO 4,28005,MADRID,"  Metro: Sol (líneas 1, 2 y 3), Tirso de Molina (línea 1), La Latina (línea 5).  Bus: 31, 50, 65, SE712.  Cercanías Renfe: Sol (líneas C3, C4 y C4a).  Bicimad: Estaciones 35 (plaza del Cordón), 9 (plaza de San Miguel, 9).  Aparcamiento: Plaza Mayor (55).",3,N/A,,,,,
https://datos.madrid.es/egob/catalogo/tipo/entidadesyorganismos/18319-capilla-san-ignacio-vascos.json,Capilla de San Ignacio de los Vascos,CALLE PRINCIPE 31,28012,MADRID,"  Metro: Antón Martín (Línea,1), Sol (líneas 1, 2 y 3).  Bus: 002, M1, SE712, 51.   Cercanías Renfe: Sol (líneas C3, C4 y C4a).  Bicimad: Estación 52 (plaza Santa Ana, 10), 33 (calle Carreteras, 8), 34 (plaza Jacinto Benavente), 28 (calle Alcalá, 27), 56 (plaza del Carmen).  Aparcamiento: Plaza de Santa Ana (77).",3,N/A,,,,,
https://datos.madrid.es/egob/catalogo/tipo/entidadesyorganismos/11242837-capilla-san-isidro.json,Capilla de San Isidro,CALLE AGUILA 1,28005,MADRID," Descripción monumental: el Oratorio está ubicado en el solar donde, según la tradición, nació y pasó su infancia el patrón de la ciudad de Madrid, San Isidro Labrador. Metro: La Latina (línea 5), Puerta de Toledo (línea 5).  Bus: 60, 148, 3, 002, 17, 18, 23, 35.  Bicimad: Estaciones 38 (carrera de San Francisco, 1), 37 (plaza de San Francisco, 5).  Aparcamiento: La Latina (86) calle de Toledo.",1,N/A,,,,"Día 4 de cada mes (si coincide con un sábado, domingo o festivo se traslada la apertura al primer día laborable) de 10 a 14 horas. El día de apertura de la Capilla se celebra misa a las 13 horas. Cerrada el mes de agosto.",
https://datos.madrid.es/egob/catalogo/tipo/entidadesyorganismos/60210-capilla-nuestra-senora-bien-aparecida.json,Capilla Nuestra Señora de la Bien Aparecida,CALLE PIO BAROJA 2,28009,MADRID,"  Metro: Ibiza (línea 9), Sainz de Baranda (líneas 6 y 9).  Bus: 26, 61, 63, C2, 15, 2, 215.   Bicimad: Estación 71 (calle Doce de Octubre, 28).",3,N/A,,,,,
https://datos.madrid.es/egob/catalogo/tipo/entidadesyorganismos/3649-centro-pastoral-vicaria-iv-nuestra-senora-piedad-.json,Centro Pastoral de la Vicaría IV Nuestra Señora de la Piedad.,CALLE ANTONIO FOLGUERAS 24,28018,MADRID,"  Metro: Portazgo (línea 1).  Bus: 103, 310.  Bicimad: Estación 429 (calle de Carlos Martín Álvarez, 38).",3,N/A,,,,,
https://datos.madrid.es/egob/catalogo/tipo/entidadesyorganismos/3355-concepcion-real-calatrava.json,Concepción Real de Calatrava,CALLE ALCALA 25,28014,MADRID,"  Metro: Sevilla (línea 2), Gran Vía (líneas 1 y 5).  Bus: 46, 52, 150, 5, 51, 002, 15, 20, 53, 9, 001, 1, 146, 2, 3, 74, M1.  Bicimad: Estación 28 (calle Alcalá, 27).  Aparcamiento: Sevilla (41) calle Sevilla y calle Alcalá.",3,N/A,,,,,
https://datos.madrid.es/egob/catalogo/tipo/entidadesyorganismos/3354-convento-comendadoras-santiago.json,Convento de las Comendadoras de Santiago,PLAZA COMENDADORAS 10,28015,MADRID,"El templo fue construido entre 1667 y 1679 por Manuel del Olmo y José del Olmo. El convento data del siglo XVIII  y es obra de Francisco de Sabatini. Es destacable la iglesia de planta cruciforme con gran cúpula central y cuatro exedras semicirculares, así como la sacristía de planta elíptica construida entre 1745 y 1754 por Francisco Moradillo. Más información en la página web de Monumenta Madrid Metro: San Bernardo (líneas 2, 4), Ventura Rodríguez (línea 3) Bus: 1, 2, 21, 44, 74, 133, 147, C",0,N/A,,,,,
https://datos.madrid.es/egob/catalogo/tipo/entidadesyorganismos/3687-convento-santa-teresa-san-jose-carmelitas-descalzos-.json,Convento de Santa Teresa y San José (Carmelitas Descalzos),PLAZA ESPAÑA 14,28008,MADRID,"  Metro: Plaza de España (líneas 3 y 10), Príncipe Pio (líneas 6, 10 y Ramal), Ventura Rodríguez (línea 3).  Bus: 138, 25, 39, 46, 62, 75, C2, C1.  Cercanías Renfe: Príncipe Pío (líneas C1, C7 y C10).  Bicimad: Estaciones 116 a y b (calle Princesa, 5), 115 (calle Evaristo San Miguel, 2), 14 (calle Ventura Rodríguez, 2).  Aparcamientos: Plaza de España (53), plaza de Oriente (32).",3,N/A,,,,,
https://datos.madrid.es/egob/catalogo/tipo/entidadesyorganismos/6079820-ermita-san-isidro.json,Ermita de San Isidro,PASEO ERMITA DEL SANTO 72,28019,MADRID," Descripción monumental: Santuario cuyo origen se remonta a la Edad Media, ubicado junto al manantial que San Isidro había hecho brotar milagrosamente para dar de beber a su amo Iván de Vargas y que la tradición popular atribuye propiedades curativas, de una sola nave con pórtico, cúpula hexagonal cubierta de pizarra coronada por una linterna, reconstruido según el modelo de 1724. Metro: Marqués de Vadillo (línea 5).  Bus: 25, 50, 17  Bicimad: Estación 212 (glorieta Marqués de Vadillo, 9).",0,N/A,,,,De lunes a domingo de 10 a 14 horas.  Culto: sábados (misa por los difuntos de la semana) a las 12 horas. Domingos a las 12 horas.  Cerrada los días de apertura de la Capilla de San Isidro y durante el mes de agosto.,
https://datos.madrid.es/egob/catalogo/tipo/entidadesyorganismos/3357-ermita-virgen-puerto.json,Ermita Virgen del Puerto,PASEO VIRGEN DEL PUERTO 4,28005,MADRID," Descripción monumental: Construido por Pedro Ribera en 1718.  Se encuadra en un proyecto urbanístico propuesto por el propio arquitecto para toda la ribera del Manzanares. De planta octogonal con exedras, lleva cubierta de pizarra. Metro: Príncipe Pio (líneas 6, 10 y Ramal), Puerta del Ángel (línea 6).  Bus: 41, 62, C2, 138, 25, 33, 39, C1, 31, 65.   Cercanías Renfe: Príncipe Pío (líneas C1, C7 y C10).    Bicimad: Estación 167 (calle Segovia, 45).",3,N/A,,,,,
https://datos.madrid.es/egob/catalogo/tipo/entidadesyorganismos/11506113-fuente-san-isidro.json,Fuente de San Isidro,PASEO ERMITA DEL SANTO 72,28019,MADRID," Descripción monumental: Manantial de origen medieval, que San Isidro Labrador había hecho brotar milagrosamente al clavar su aguijada en el suelo para dar de beber a su señor Iván de Vargas, que la tradición popular atribuye propiedades curativas. Metro: Marqués de Vadillo (línea 5)  Bus: 25, 17, 50  Bicimad:  Estación 212 (glorieta Marqués de Vadillo, 9)",1,N/A,,,,De lunes a domingo de 9 a 15 horas.,
https://datos.madrid.es/egob/catalogo/tipo/entidadesyorganismos/3356-iglesia-catedral-fuerzas-armadas.json,Iglesia Catedral de las Fuerzas Armadas,CALLE SACRAMENTO 11,28005,MADRID,"  Metro: Ópera (Líneas 2, 5 y Ramal).  Bus: 148, 3, SE712, 31, 50, 65.  Bicimad: Estaciones 166 (calle Segovia, 26), 35 (plaza del Cordón, 1), 36 (plaza de Ramales), 9 (plaza de San Miguel, 9), 24 (calle Carlos III, 1).",3,N/A,,,,,
https://datos.madrid.es/egob/catalogo/tipo/entidadesyorganismos/3734-iglesia-convento-santisimo-cristo-pardo.json,Iglesia Convento del Santísimo Cristo del Pardo,PISTA CRISTO DE EL PARDO 11,28048,MADRID,  ,3,N/A,,,,,
https://datos.madrid.es/egob/catalogo/tipo/entidadesyorganismos/3480-iglesia-cristo-rey-arguelles.json,Iglesia Cristo Rey de Argüelles,CALLE MARTIN DE LOS HEROS 91,28008,MADRID,"  Metro: Arg&amp;uuml;elles (líneas 3, 4 y 6), Moncloa (líneas 3 y 6).  Bus: 62, 74.  Bicimad: Estación 117 (calle Altamirano, 24), 111a (calle Arcipreste de Hita, 12), 111b (calle Arcipreste de Hita, 12), 110 (paseo de Moret, 2).  Aparcamiento: Marqués de Urqujo (63) Marqués de Urquijo entre calle Princesa y calle Juan Álvarez de Mendizabal.",3,N/A,,,,,
https://datos.madrid.es/egob/catalogo/tipo/entidadesyorganismos/18320-iglesia-santisima-trinidad-trinitarios-.json,Iglesia de la Santísima Trinidad (Trinitarios),CALLE ECHEGARAY 30,28014,MADRID,"  Metro: Antón Martín (línea 1), Sol (líneas 1, 2 y 3).  Bus: 002, M1, SE712, 26, 32, 6.  Cercanías Renfe: Sol (líneas C3, C3a, C4 y C4a).  Bicimad: Estación 52 (plaza de Santa Ana, 10), 41 (calle Atocha, 54).  Aparcamiento: Plaza de Santa Ana (77).",3,N/A,,,,,
https://datos.madrid.es/egob/catalogo/tipo/entidadesyorganismos/3617-iglesia-maria-reina.json,Iglesia de María Reina,CALLE PICO DE LA MALICIOSA 9,28038,MADRID,"  Metro: Portazgo (línea 1).  Bus: 103, 136, 54, 58, SE853.  Bicimad: Estación 428 (avenida de la Albufera, 136).",3,N/A,,,,,
https://datos.madrid.es/egob/catalogo/tipo/entidadesyorganismos/3573-iglesia-nuestra-senora-maravillas.json,Iglesia de Nuestra Señora de las Maravillas,CALLE DOS DE MAYO 11,28004,MADRID,"  Metro: Tribunal (líneas 1 y 10), Bilbao (líneas 1 y 4), Noviciado (línea 2), San Bernardo (líneas 2 y 4).  Bus: 002, 147.  Bicimad: Estaciones 11 (calle San Andrés, 18), 59 (calle Espíritu Santo, 30).",3,N/A,,,,,
https://datos.madrid.es/egob/catalogo/tipo/entidadesyorganismos/3743-iglesia-san-anton.json,Iglesia de San Antón,CALLE HORTALEZA 63,28004,MADRID,"  Metro: Chueca (línea 5), Tribunal (líneas 1 y 10), Alonso Martínez (líneas 4, 5 y 10).  Bus: 3.  Cercanías Renfe: Recoletos (líneas C1, C2, C7, C8 y C10).  Bicimad: Estación 6 (calle Hortaleza, 63), 7 (calle Hortaleza, 75), 58 (calle Augusto Figueroa, 33).  Aparcamiento: Aparcamiento Escuelas de San Antón (91) Santa Brígida.",3,N/A,,,,,
https://datos.madrid.es/egob/catalogo/tipo/entidadesyorganismos/3514-iglesia-san-felipe-neri.json,Iglesia de San Felipe Neri,CAMINO VALDERRIBAS 39,28038,MADRID,"  Metro: Nueva Numancia (línea 1), Pacífico (líneas 1 y 6).  Bus: 141, 113, 8.  Bicimad: Estaciones 225 (calle Sierra Toledana, 33), 226 (camino de Valderribas, 94), 431 (puerto de Canfranc, 18), 179 (avenida de la Albufera, 6).",3,N/A,,,,,
https://datos.madrid.es/egob/catalogo/tipo/entidadesyorganismos/18313-iglesia-espiritu-santo.json,Iglesia del Espíritu Santo,CALLE SERRANO 125,28006,MADRID,"  Metro: República Argentina (Línea 6).  Bus: 16, 19, 51.  Bicimad: Estación 250 (calle Serrano, 113B).",3,N/A,,,,,
https://datos.madrid.es/egob/catalogo/tipo/entidadesyorganismos/3729-iglesia-santo-nino-remedio.json,Iglesia del Santo Niño del Remedio,CALLE DONADOS 6,28013,MADRID,"  Metro: Ópera (líneas 2, 5 y Ramal).  Bus: 75, 147, 148, 146, 44, SE712.   Bicimad: Estaciones 25 a y b (plaza de Celenque, 1), 31 (calle Mayor, 20), 24 (calle Carlos III, 1), 23 (plaza de Santo Domingo, 1), 22 (calle Jacometrezo, 3), 2 (calle Miguel Moya, 1), 9 (plaza de San Miguel, 9).    Aparcamiento: Descalzas (20) plaza Descalzas y plaza San Martín.",3,N/A,,,,,
https://datos.madrid.es/egob/catalogo/tipo/entidadesyorganismos/3736-iglesia-esclavas-sagrado-corazon-jesus.json,Iglesia Esclavas del Sagrado Corazón de Jesús,PASEO GENERAL MARTINEZ CAMPOS 10,28010,MADRID,"  Metro: Iglesía (línea 1).  Bus: 16, 5, 61, 3, 37.  Bicimad: Estaciones 246 (calle Santa Engracia, 87), 125 (calle Fernández de la Hoz, 29).",3,N/A,,,,,
https://datos.madrid.es/egob/catalogo/tipo/entidadesyorganismos/18321-iglesia-madres-dominicas-monasterio-santo-domingo-real-.json,Iglesia Madres Dominicas (Monasterio Santo Domingo el Real),CALLE CLAUDIO COELLO 112,28006,MADRID,"  Metro: Núñez de Balboa (líneas 5 y 9).  Bus: 61, 16, 19, 51, 9.  Bicimad: Estación 190 (calle Velázquez, 91).",3,N/A,,,,,
https://datos.madrid.es/egob/catalogo/tipo/entidadesyorganismos/190377-iglesia-nuestra-senora-paz.json,Iglesia Nuestra Señora de la Paz,CALLE DOCTOR ESQUERDO 44,28007,MADRID,"  Metro: O'Donnell (Línea 6).  Bus: 143, 156, 2, 30, 56, 203, 28, E2, E3, E4, E5, 71.  Bicimad: Estaciones 101 (calle Jorge Juan, 131), 62 (calle O'Donell, 50), 63 (calle Ibiza, 62), 182 (calle Alcade Sáinz de Baranda, frente al número 107), 72 (calle Doctor Esquerdo, 99).",3,N/A,,,,,
https://datos.madrid.es/egob/catalogo/tipo/entidadesyorganismos/3577-iglesia-nuestra-senora-lourdes-san-justino-iglesia-renovacion-carismatica.json,Iglesia Nuestra Señora de Lourdes y San Justino. Iglesia de la Renovación Carismática,CALLE SAN JUAN DE MATA 30,28011,MADRID,"  Metro: Casa de Campo (líneas 5 y 10).  Bus: 55, 65, 36, 39.",3,N/A,,,,,
https://datos.madrid.es/egob/catalogo/tipo/entidadesyorganismos/60211-iglesia-nuestra-senora-montserrat.json,Iglesia Nuestra Señora de Montserrat,CALLE SAN BERNARDO 79,28015,MADRID,"  Metro: San Bernardo, (líneas 2 y 4), Bilbao (líneas 1 y 4), Tribunal (líneas 1 y 10), Noviciado (línea 2).  Bus: 147, 3, 21, C03.  Bicimad: Estación 12 (calle San Bernardo, 85), 15 (calle norte, 8), 59 (calle Espíritu Santo, 30), 11 (calle San Andrés, 18), 5 (calle Fuencarral, 108), 4 (calle Manuela Malasaña, 5), 54 (calle Barceló, 7), 13 (calle Conde Duque, 22), 3 (plaza del Conde del Valle de Súchil, 3).",3,N/A,,,,,
https://datos.madrid.es/egob/catalogo/tipo/entidadesyorganismos/3365-iglesia-san-antonio-alemanes.json,Iglesia San Antonio de los Alemanes,CALLE CORREDERA BAJA DE SAN PABLO 16,28004,MADRID," Descripción monumental:  Proyectada por Pedro Sánchez, año 1624 y Francisco Seseña, año 1624 - 1633. Fachada, por Juan Gómez de Mora, año 1624 - 1630. Fundación de Felipe III, 1606. Magnífico ejemplo del Barroco madrileño con interesantes elementos arquitectónicos y frescos en paredes y cúpula que forman una unidad de espacio irreal. La gran cúpula oval, decorada con arquitecturas fingidas y escenas de la Apoteosis de San Francisco de Paula, de Francisco Ricci y Carreño de Miranda,refuerza esta impresión.  Lucas Jordán, sin pauta de continuidad, decora los muros curvos con escenas de la vida del San Antonio.  El retablo mayor, de mediados del siglo XVIII, es obra del arquitecto Miguel Fernández con el escultor Francisco Gutiérrez. Obra compleja, fue replanteada por Juan Gómez de Mora quien redibujó la fachada. Muestra un edificio anexo en ladrillo y planta triangular para la Hermandad del Refugio y Piedad de Madrid, fundada en 1615 con su tradicional 'ronda del pan y huevo'.  Dicho edificio data de la década de 1880, quizá por Ruiz de Salces quien proyectó la reforma de la fachada buscando la armonía total. Metro: Callao (líneas 3 y 5), Gran Vía (líneas 1 y 5), Noviciado (línea 2), Santo Domingo (línea 2), Chueca (línea 5), Tribunal (líneas 1 y 10).  Bus: 002.  Bicimad: Estación 17 (plaza de Carlos Cambronero, 2), 55 (plaza de San Ildefonso), 59 (calle Espíritu Santo, 30), 211 (calle Desengaño, 1), 2 (calle Miguel Moya, 1), 210 (calle Tres Cruces, 7), 18 (plaza de Pedro Zerolo, 1), 16 (calle San Bernardo, 22), 22 (calle Jacometrezo, 3).  Aparcamiento: Barco 1 (88), calle Barco.",3,N/A,,,,,
https://datos.madrid.es/egob/catalogo/tipo/entidadesyorganismos/60228-iglesia-san-jose-montana.json,Iglesia San José de la Montaña,CALLE FERNANDEZ DE LA HOZ 16,28010,MADRID,"  Metro: Rubén Darío (línea 5), Alonso Martínez (línea 4, 5 y 10), Bilbao (líneas 1 y 4), Iglesia (línea 1).  Bus: 3, 7, 147, 40.  Bicimad: Estación 122 (calle Santa Engracia, 14), 8 (plaza Alonso Martínez, 5), 124 (calle Manuel Silvela, 20).  Aparcamiento: Almagro (12) calle Almagro 11.",3,N/A,,,,,
https://datos.madrid.es/egob/catalogo/tipo/entidadesyorganismos/3346-iglesia-san-pedro-viejo.json,Iglesia San Pedro el Viejo,CALLE NUNCIO 14,28005,MADRID,"  Metro: La Latina (línea 5), Tirso de Molina (línea 1).  Bus: 31, 50, 65.  Bicimad: Estación 35 (plaza del Cordón), 9 (plaza de San Miguel, 9), 38 (carrera de San Francisco, 1), 166 (calle Segovia, 26), 39 (plaza de la Cebada, 16), 32 (plaza de la Provincia, 1), 31 (calle Mayor, 20), 34 (plaza de Jacinto Benavente), 37 (plaza de San Francisco, 5).",3,N/A,,,,,
https://datos.madrid.es/egob/catalogo/tipo/entidadesyorganismos/3732-monasterio-inmaculada-san-pascual-clarisas-.json,Monasterio de la Inmaculada y San Pascual (Clarisas),PASEO RECOLETOS 11,28004,MADRID,"  Metro: Banco de España (línea 2).  Bus: 14, 150, 27, 37, 45, 5, C03, 53, 001, 1, 146, 15, 2, 20, 203, 51, 52, 74, 9.  Cercanías Renfe: Recoletos (líneas C1, C2, C7, C8 y C10).  Bicimad: Estaciones 94 (paseo de Recoletos, 20), 19 (calle Prim, 2), 20a (calle Alcalá, 49), 86 (plaza Cibeles).  Aparcamientos: Garaje Piamonte (96) piamonte; plaza del Rey (54) plaza del Rey y calle Barquillo con calle Infantas.",3,N/A,,,,,
https://datos.madrid.es/egob/catalogo/tipo/entidadesyorganismos/3368-monasterio-santisima-trinidad-san-ildefonso-trinitarias-.json,Monasterio de la Santísima Trinidad y de San Ildefonso (Trinitarias),CALLE LOPE DE VEGA 18,28014,MADRID,"El monumento conmemorativo alberga los restos hallados en la cripta del convento. Con la colocación de los restos de Miguel de Cervantes en la nave de la actual iglesia del siglo XVIII  se cumple la voluntad testamentaria del autor de 'El Quijote'. Miguel de Cervantes, que fue enterrado en la primitiva iglesia el 23 de abril de 1616, expresó en su última voluntad descansar allí en agradecimiento a los Trinitarios que le liberaron de los cinco años y medio de cautiverio en Argel, en manos de los piratas berberiscos.  Descripción monumental: Construido por Marcos López entre 1673 y 1688 con gran austeridad constructiva y decorativa.  Metro: Antón Martín (Línea 1).  Bus: 26, 32, 6, 002, M1, SE712, 001, 10, 14, 27, 34, 37, 45, C03.  Bicimad: Estaciones 27 (calle Jesús, 1), 41 (calle Atocha, 54), 52 (plaza de Santa Ana, 10), 29 (calle del Marqués de Cubas, 25), 42 (calle Santa Isabel, 32).  Aparcamiento: Plaza de Santa Ana (77).",3,N/A,,,,,
https://datos.madrid.es/egob/catalogo/tipo/entidadesyorganismos/18314-monasterio-nuestra-senora-maravillas-carmelitas-calzadas-antigua-observancia-.json,Monasterio de Nuestra Señora de las Maravillas (Carmelitas Calzadas de la antigua observancia),CALLE PRINCIPE DE VERGARA 23,28001,MADRID,"  Metro: Velázquez (línea 4), Goya (Líneas 2 y 4), Príncipe de Vergara (líneas 2 y 9).  Bus: 29, 52, 21, 53.  Bicimad: Estación 91 (calle Hermosilla, 70).",3,N/A,,,,,
https://datos.madrid.es/egob/catalogo/tipo/entidadesyorganismos/3364-monasterio-san-placido-benedictinas-.json,Monasterio de San Plácido (Benedictinas),CALLE SAN ROQUE 9,28004,MADRID,"  Metro: Noviciado (línea 2), Santo Domingo (línea 2), Callao (líneas 3 y 5), Gran Vía (líneas 1 y 5).  Bus: 002.  Bicimad: Estación 17 (plaza de Carlos Cambronero, 2).  Aparcamiento: Luna-Tudescos (14) plaza Santa María Soledad Torres Acosta con vuelta calle Luna.",3,N/A,,,,,
https://datos.madrid.es/egob/catalogo/tipo/entidadesyorganismos/3363-monasterio-corpus-christi-jeronimas-carboneras-.json,Monasterio del Corpus Christi (Jerónimas 'Carboneras'),PLAZA CONDE DE MIRANDA 3,28005,MADRID,"  Metro: Ópera (líneas 2 y 5 y Ramal), La Latina (línea 5), Tirso de Molina (línea 1), Sol (líneas 1, 2 y 3).  Bus: SE712, 31, 50, 65.  Cercanías Renfe: Sol (líneas C3, C3a, C4, C4a).  Bicimad: Estaciones 35 (plaza del Cordón) y 9 (plaza de San Miguel, 9).",3,N/A,,,,,
https://datos.madrid.es/egob/catalogo/tipo/entidadesyorganismos/8182988-nuestra-senora-merced-parroquia-personal-habla-inglesa.json,Nuestra Señora de la Merced - Parroquia personal de habla inglesa,CALLE MAURICIO LEGENDRE 10,28046,MADRID,"Para personas de habla inglesa.  Metro: Chamartín (líneas 1 y 10).  Bus: 66, SE704, 5, T62, 124, 134, 135, 147, 173, 174, 175, 176, 178, 67.  Cercanías Renfe: Chamartín (líneas C1, C2, C3, C4, C7, C8 y C10).  Bicimad: Estación 252 (calle Rodríguez Jaén, 40).",3,N/A,,,,,
https://datos.madrid.es/egob/catalogo/tipo/entidadesyorganismos/3737-oratorio-hospitalidad-nuestra-senora-lourdes.json,Oratorio de la Hospitalidad de Nuestra Señora de Lourdes,CALLE FORTUNY 21,28010,MADRID,"  Metro: Rubén Darío (línea 5), Alonso Martínez (líneas 4, 5 y 10).   Bus: 7, 14, 150, 27, 45, 5.  Bicimad: Estación 198 (paseo de la Castellana, 33), 103 (calle José Ortega y Gasset, 4), 142 (paseo de la Castella, 42).  Aparcamiento: Almagro (12) calle Almagro, 11.",3,N/A,,,,,
https://datos.madrid.es/egob/catalogo/tipo/entidadesyorganismos/60230-oratorio-san-felipe-neri.json,Oratorio San Felipe Neri,CALLE ANTONIO ARIAS 17,28009,MADRID,"  Metro: Sáinz de Baranda (líneas 6 y 9).  Bus: 15, 215, 2, 143, 156, 30, 56.  Bicimad: Estaciones 71 (calle Doce de Octubre, 28), 63 (calle Ibiza, 62), 72 (calle Doctor Esquerdo, 99).",3,N/A,,,,,
https://datos.madrid.es/egob/catalogo/tipo/entidadesyorganismos/3428-parroquia-ascension-senor.json,Parroquia Ascensión del Señor,CALLE VIA CARPETANA 105,28047,MADRID,"  Metro: Carpetana (línea 6).  Bus: 17, 25, 119.",3,N/A,,,,,
https://datos.madrid.es/egob/catalogo/tipo/entidadesyorganismos/3429-parroquia-asuncion-nuestra-senora-calle-gabriel-galan.json,Parroquia Asunción de Nuestra Señora. Calle Gabriel y Galán,CALLE GABRIEL Y GALAN 17,28002,MADRID,"  Metro: Alfonso XIII (Línea 4), Avenida de la Paz (línea 4).  Bus: 120, 43, 40, 72, 73, 9.",3,N/A,,,,,
https://datos.madrid.es/egob/catalogo/tipo/entidadesyorganismos/3430-parroquia-asuncion-nuestra-senora-calle-perez-victoria.json,Parroquia Asunción de Nuestra Señora. Calle Pérez de Victoria,CALLE PEREZ DE VICTORIA 9,28023,MADRID,  Bus: 160.  Aparcamiento: Corona Boreal (6) plaza Corona Boreal y calle Marqués Camarines.,3,N/A,,,,,
https://datos.madrid.es/egob/catalogo/tipo/entidadesyorganismos/3437-parroquia-bautismo-senor.json,Parroquia Bautismo del Señor,CALLE GAVILANES 11,28035,MADRID,  Bus: 82.,3,N/A,,,,,
https://datos.madrid.es/egob/catalogo/tipo/entidadesyorganismos/3591-parroquia-beata-maria-ana-jesus.json,Parroquia Beata María Ana de Jesús,CALLE GUILLERMO DE OSMA 10,28045,MADRID,"  Metro: Legazpi (líneas 3 y 6).  Bus: 62, 148, 18, 6, 78, 76, 19, 247, 45, 47, 59, 8, 85, 86.  Bicimad: Estación 165 (paseo de la Chopera, 14), 266 (paseo de la Chopera, 53), 175 (calle Jaime el Conquistador, 30), 267 (paseo de la Chopera, 33), 176 (calle Alicante, 3), 177 (calle Bolívar, 3), 164 (paseo de las Delicias, 94).",3,N/A,,,,,
https://datos.madrid.es/egob/catalogo/tipo/entidadesyorganismos/45867-parroquia-beata-maria-ana-mogas.json,Parroquia Beata María Ana Mogas,CALLE BELLA ALTISIDORA 6,28034,MADRID,"  Metro: Tres Olivos (línea 10).  Bus: 137, 66.",3,N/A,,,,,
https://datos.madrid.es/egob/catalogo/tipo/entidadesyorganismos/3449-parroquia-buen-pastor.json,Parroquia Buen Pastor,AVENIDA PARQUE DE PALOMERAS BAJAS 22,28018,MADRID,"  Bus: 136, 102, 103, 310, T31, 10.  Cercanías Renfe: El Pozo (líneas C2, C7 y Regional).  Bicimad: Estación 419 (calle Puerto de Balbarán, 10).",3,N/A,,,,,
https://datos.madrid.es/egob/catalogo/tipo/entidadesyorganismos/60184-parroquia-castrense-santa-maria-dehesa.json,Parroquia Castrense Santa María de la Dehesa,AVENIDA ARQUEROS 19,28024,MADRID,  Metro: Cuatro Vientos (línea 10).  Bus: 139.  Cercanías Renfe: Cuatro Vientos (línea C5).,3,N/A,,,,,
https://datos.madrid.es/egob/catalogo/tipo/entidadesyorganismos/3465-parroquia-concepcion-nuestra-senora.json,Parroquia Concepción de Nuestra Señora,CALLE GOYA 26,28001,MADRID,"  Bus: 21, 53, 1, 19, 51, 74, 9, 29, 52.  Metro: Velázquez (línea 4), Príncipe de Vergara (líneas 2 y 9).  Bicimad: Estación 90 (calle Goya, 18).",3,N/A,,,,,
https://datos.madrid.es/egob/catalogo/tipo/entidadesyorganismos/3478-parroquia-cristo-paz.json,Parroquia Cristo de la Paz,CALLE PORTALEGRE 8,28019,MADRID,"  Metro: Opañel (línea 6), Urgel (línea 5).  Bus: 118.  Bicimad: Estación 356 (calle Portalegre, 7).",3,N/A,,,,,
https://datos.madrid.es/egob/catalogo/tipo/entidadesyorganismos/3479-parroquia-cristo-resucitado.json,Parroquia Cristo Resucitado,CALLE CEBREROS 56,28011,MADRID,"  Metro: Lucero (línea 6).  Bus: 138.  Bicimad: Estación 324 (calle de las Higueras, 49), 327 (calle El Greco, 27), 328 (calle Cebreros, 97).",3,N/A,,,,,
https://datos.madrid.es/egob/catalogo/tipo/entidadesyorganismos/3481-parroquia-cristo-rey-usera.json,Parroquia Cristo Rey de Usera,CALLE AMOR HERMOSO 15,28026,MADRID,"  Metro: Usera (línea 6).  Bus: 247, 47.  Bicimad: Estación 384 (calle Amparo Usera, 46), 389 (calle Julio Merino, 5), 213 (calle Antonio López, 129).",3,N/A,,,,,
https://datos.madrid.es/egob/catalogo/tipo/entidadesyorganismos/189085-parroquia-cristo-sacerdote.json,Parroquia Cristo Sacerdote,CALLE LOPEZ DE ARANDA 52,28027,MADRID,"  Metro: Suanzes (línea 5).  Bus: 146, 114.",3,N/A,,,,,
https://datos.madrid.es/egob/catalogo/tipo/entidadesyorganismos/3483-parroquia-cristo-salvador.json,Parroquia Cristo Salvador,CALLE CARACOLI 1,28033,MADRID,"  Metro: San Lorenzo (línea 4).  Bus: 72, 87, T11.",3,N/A,,,,,
https://datos.madrid.es/egob/catalogo/tipo/entidadesyorganismos/3485-parroquia-crucifixion-senor.json,Parroquia Crucifixión del Señor,CALLE CUART DE POBLET 11,28047,MADRID,"  Metro: Laguna (línea 6).  Bus: 119, 31, 55.  Cercanías Renfe: Laguna (línea C5).",3,N/A,,,,,
https://datos.madrid.es/egob/catalogo/tipo/entidadesyorganismos/60216-parroquia-armada-nuestra-senora-carmen.json,Parroquia de la Armada de Nuestra Señora del Carmen,CALLE SERRANO GALVACHE 7,28033,MADRID,"  Bus: 107, 29, 7.",3,N/A,,,,,
https://datos.madrid.es/egob/catalogo/tipo/entidadesyorganismos/189087-parroquia-divino-salvador.json,Parroquia Divino Salvador,AVENIDA SANTUARIO DE VALVERDE 37,28049,MADRID,"  Metro: Montecarmelo (línea 10).  Bus: 134, 170, 178, SE704.",3,N/A,,,,,
